[
  {
    "archived": false,
    "colorscheme": "tokyonight",
    "description": "\ud83c\udfd9  A clean, dark Neovim theme written in Lua, with support for lsp, treesitter and lots of plugins. Includes additional themes for Kitty, Alacritty, iTerm and Fish.",
    "disabled": false,
    "homepage": "",
    "name": "tokyonight",
    "repo": "folke/tokyonight.nvim",
    "stars": 7747,
    "topics": [
      "alacritty",
      "alacritty-colorscheme",
      "alacritty-theme",
      "fish-shell",
      "fish-theme",
      "iterm2",
      "iterm2-colors",
      "kitty",
      "kitty-themes",
      "neovim",
      "neovim-colorscheme",
      "neovim-lua",
      "neovim-theme",
      "vim",
      "vim-colorscheme",
      "vim-theme"
    ],
    "updated_at": "2026-01-21T16:56:43Z"
  },
  {
    "archived": false,
    "colorscheme": "nvim",
    "description": "\ud83c\udf68 Soothing pastel theme for (Neo)vim",
    "disabled": false,
    "homepage": "",
    "name": "nvim",
    "repo": "catppuccin/nvim",
    "stars": 7128,
    "topics": [
      "catppuccin",
      "colorscheme",
      "hacktoberfest",
      "lua",
      "neovim",
      "neovim-colorscheme",
      "neovim-lua",
      "neovim-plugin",
      "neovim-theme",
      "nvim",
      "theme",
      "vim",
      "vim-theme"
    ],
    "updated_at": "2026-01-21T02:03:53Z"
  },
  {
    "archived": false,
    "colorscheme": "kanagawa",
    "description": "NeoVim dark colorscheme inspired by the colors of the famous painting by Katsushika Hokusai.",
    "disabled": false,
    "homepage": "",
    "name": "kanagawa",
    "repo": "rebelot/kanagawa.nvim",
    "stars": 5814,
    "topics": [
      "lsp",
      "lua",
      "neovim",
      "neovim-colorscheme",
      "neovim-theme",
      "nvim",
      "syntax-highlighting",
      "terminal-colors",
      "theme",
      "tree-sitter-highlight"
    ],
    "updated_at": "2026-01-21T19:43:08Z"
  },
  {
    "archived": false,
    "colorscheme": "flexoki",
    "description": "An inky color scheme for prose and code.",
    "disabled": false,
    "homepage": "https://stephango.com/flexoki",
    "name": "flexoki",
    "repo": "kepano/flexoki",
    "stars": 2939,
    "topics": [
      "alacritty",
      "color",
      "color-scheme",
      "colors",
      "ghostty",
      "intellij",
      "iterm2",
      "kitty",
      "neovim",
      "neovim-colorscheme",
      "sublime-text",
      "tailwind",
      "terminal-colors",
      "theme",
      "vscode",
      "vscode-theme",
      "wezterm",
      "xresources"
    ],
    "updated_at": "2026-01-21T21:04:10Z"
  },
  {
    "archived": false,
    "colorscheme": "gruvbox",
    "description": "Lua port of the most famous vim colorscheme",
    "disabled": false,
    "homepage": "",
    "name": "gruvbox",
    "repo": "ellisonleao/gruvbox.nvim",
    "stars": 2439,
    "topics": [
      "colorscheme",
      "gruvbox",
      "lua",
      "neovim",
      "neovim-colorscheme",
      "neovim-plugin",
      "neovim-plugins"
    ],
    "updated_at": "2026-01-21T14:34:53Z"
  },
  {
    "archived": true,
    "colorscheme": "onedark",
    "description": "Atom's iconic One Dark theme for Neovim, written in Lua",
    "disabled": false,
    "homepage": "",
    "name": "onedark",
    "repo": "ful1e5/onedark.nvim",
    "stars": 201,
    "topics": [
      "hacktoberfest",
      "lua",
      "nvim-theme"
    ],
    "updated_at": "2025-09-13T11:40:41Z"
  },
  {
    "archived": false,
    "colorscheme": "gruber-darker",
    "description": "Neovim Lua port of gruber-darker-theme",
    "disabled": false,
    "homepage": "",
    "name": "gruber-darker",
    "repo": "blazkowolf/gruber-darker.nvim",
    "stars": 193,
    "topics": [
      "colorscheme",
      "lua",
      "neovim",
      "neovim-colorscheme",
      "neovim-plugin",
      "neovim-theme",
      "nvim",
      "nvim-colorscheme",
      "nvim-plugin",
      "nvim-theme"
    ],
    "updated_at": "2026-01-21T16:30:49Z"
  },
  {
    "archived": false,
    "colorscheme": "biscuit",
    "description": "Cozy and warm colorscheme for the forest dwellers. An alternative to most boring modern colorschemes.",
    "disabled": false,
    "homepage": "",
    "name": "biscuit",
    "repo": "Biscuit-Theme/biscuit",
    "stars": 182,
    "topics": [
      "colors",
      "colorschemes",
      "css",
      "linux",
      "neovim-theme",
      "nvim-theme",
      "ricing",
      "theme",
      "themes"
    ],
    "updated_at": "2026-01-09T17:52:05Z"
  },
  {
    "archived": false,
    "colorscheme": "nightly",
    "description": "A customized theme for Neovim, based on the Everblush color scheme.",
    "disabled": false,
    "homepage": "",
    "name": "nightly",
    "repo": "Alexis12119/nightly.nvim",
    "stars": 78,
    "topics": [
      "colorscheme",
      "lua",
      "neovim",
      "neovim-colorscheme",
      "neovim-theme",
      "nvim",
      "nvim-theme",
      "personal",
      "simple",
      "theme",
      "treesitter",
      "vim"
    ],
    "updated_at": "2026-01-09T17:52:40Z"
  },
  {
    "archived": false,
    "colorscheme": "lavi",
    "description": "\ud83e\udebb A soft and sweet colorscheme for Neovim & more",
    "disabled": false,
    "homepage": "",
    "name": "lavi",
    "repo": "b0o/lavi.nvim",
    "stars": 46,
    "topics": [
      "neovim",
      "neovim-colorscheme",
      "neovim-plugin",
      "neovim-theme",
      "nvim",
      "nvim-colorscheme",
      "nvim-theme"
    ],
    "updated_at": "2026-01-09T17:53:05Z"
  },
  {
    "archived": false,
    "colorscheme": "oxocarbon",
    "description": "A dark and light Neovim theme written in fennel, inspired by IBM Carbon.",
    "disabled": false,
    "homepage": "",
    "name": "oxocarbon",
    "repo": "nyoom-engineering/oxocarbon.nvim",
    "stars": 1514,
    "topics": [
      "color-scheme",
      "neovim",
      "neovim-colorscheme",
      "neovim-theme",
      "rust",
      "theme",
      "vim",
      "vim-colorscheme"
    ],
    "updated_at": "2026-01-21T23:28:43Z"
  }
]